
*** Running vivado
    with args -log ALU_4bits.vdi -applog -m64 -product Vivado -messageDb vivado.pb -mode batch -source ALU_4bits.tcl -notrace


****** Vivado v2018.2 (64-bit)
  **** SW Build 2258646 on Thu Jun 14 20:03:12 MDT 2018
  **** IP Build 2256618 on Thu Jun 14 22:10:49 MDT 2018
    ** Copyright 1986-2018 Xilinx, Inc. All Rights Reserved.

source ALU_4bits.tcl -notrace
Command: link_design -top ALU_4bits -part xc7a35tftg256-1
Design is defaulting to srcset: sources_1
Design is defaulting to constrset: constrs_1
INFO: [Netlist 29-17] Analyzing 28 Unisim elements for replacement
INFO: [Netlist 29-28] Unisim Transformation completed in 0 CPU seconds
INFO: [Project 1-479] Netlist was created with Vivado 2018.2
INFO: [Device 21-403] Loading part xc7a35tftg256-1
INFO: [Project 1-570] Preparing netlist for logic optimization
WARNING: [Constraints 18-550] Could not create 'IOSTANDARD' constraint because net 'U1/<const0>' is not directly connected to top level port. Synthesis is ignored for C:/Users/Ziyueshi/vivado/ALU_4bits/ALU_4bits.runs/synth_1/ALU_4bits/ALU_4bits.edf but preserved for implementation. [C:/Users/Ziyueshi/vivado/ALU_4bits/ALU_4bits.runs/synth_1/ALU_4bits/ALU_4bits.edf:487]
WARNING: [Constraints 18-550] Could not create 'IOSTANDARD' constraint because net 'U1/<const1>' is not directly connected to top level port. Synthesis is ignored for C:/Users/Ziyueshi/vivado/ALU_4bits/ALU_4bits.runs/synth_1/ALU_4bits/ALU_4bits.edf but preserved for implementation. [C:/Users/Ziyueshi/vivado/ALU_4bits/ALU_4bits.runs/synth_1/ALU_4bits/ALU_4bits.edf:517]
WARNING: [Constraints 18-550] Could not create 'IOSTANDARD' constraint because net 'U1/Y0[0]' is not directly connected to top level port. Synthesis is ignored for C:/Users/Ziyueshi/vivado/ALU_4bits/ALU_4bits.runs/synth_1/ALU_4bits/ALU_4bits.edf but preserved for implementation. [C:/Users/Ziyueshi/vivado/ALU_4bits/ALU_4bits.runs/synth_1/ALU_4bits/ALU_4bits.edf:860]
WARNING: [Constraints 18-550] Could not create 'IOSTANDARD' constraint because net 'U1/Y0[1]' is not directly connected to top level port. Synthesis is ignored for C:/Users/Ziyueshi/vivado/ALU_4bits/ALU_4bits.runs/synth_1/ALU_4bits/ALU_4bits.edf but preserved for implementation. [C:/Users/Ziyueshi/vivado/ALU_4bits/ALU_4bits.runs/synth_1/ALU_4bits/ALU_4bits.edf:868]
WARNING: [Constraints 18-550] Could not create 'IOSTANDARD' constraint because net 'U1/Y0[2]' is not directly connected to top level port. Synthesis is ignored for C:/Users/Ziyueshi/vivado/ALU_4bits/ALU_4bits.runs/synth_1/ALU_4bits/ALU_4bits.edf but preserved for implementation. [C:/Users/Ziyueshi/vivado/ALU_4bits/ALU_4bits.runs/synth_1/ALU_4bits/ALU_4bits.edf:876]
WARNING: [Constraints 18-550] Could not create 'IOSTANDARD' constraint because net 'U1/Y0[3]' is not directly connected to top level port. Synthesis is ignored for C:/Users/Ziyueshi/vivado/ALU_4bits/ALU_4bits.runs/synth_1/ALU_4bits/ALU_4bits.edf but preserved for implementation. [C:/Users/Ziyueshi/vivado/ALU_4bits/ALU_4bits.runs/synth_1/ALU_4bits/ALU_4bits.edf:884]
WARNING: [Constraints 18-550] Could not create 'IOSTANDARD' constraint because net 'U1/Y1[0]' is not directly connected to top level port. Synthesis is ignored for C:/Users/Ziyueshi/vivado/ALU_4bits/ALU_4bits.runs/synth_1/ALU_4bits/ALU_4bits.edf but preserved for implementation. [C:/Users/Ziyueshi/vivado/ALU_4bits/ALU_4bits.runs/synth_1/ALU_4bits/ALU_4bits.edf:899]
WARNING: [Constraints 18-550] Could not create 'IOSTANDARD' constraint because net 'U1/Y1[1]' is not directly connected to top level port. Synthesis is ignored for C:/Users/Ziyueshi/vivado/ALU_4bits/ALU_4bits.runs/synth_1/ALU_4bits/ALU_4bits.edf but preserved for implementation. [C:/Users/Ziyueshi/vivado/ALU_4bits/ALU_4bits.runs/synth_1/ALU_4bits/ALU_4bits.edf:907]
WARNING: [Constraints 18-550] Could not create 'IOSTANDARD' constraint because net 'U1/Y1[2]' is not directly connected to top level port. Synthesis is ignored for C:/Users/Ziyueshi/vivado/ALU_4bits/ALU_4bits.runs/synth_1/ALU_4bits/ALU_4bits.edf but preserved for implementation. [C:/Users/Ziyueshi/vivado/ALU_4bits/ALU_4bits.runs/synth_1/ALU_4bits/ALU_4bits.edf:915]
WARNING: [Constraints 18-550] Could not create 'IOSTANDARD' constraint because net 'U1/Y1[3]' is not directly connected to top level port. Synthesis is ignored for C:/Users/Ziyueshi/vivado/ALU_4bits/ALU_4bits.runs/synth_1/ALU_4bits/ALU_4bits.edf but preserved for implementation. [C:/Users/Ziyueshi/vivado/ALU_4bits/ALU_4bits.runs/synth_1/ALU_4bits/ALU_4bits.edf:923]
WARNING: [Constraints 18-550] Could not create 'IOSTANDARD' constraint because net 'U1/a_to_g[0]' is not directly connected to top level port. Synthesis is ignored for C:/Users/Ziyueshi/vivado/ALU_4bits/ALU_4bits.runs/synth_1/ALU_4bits/ALU_4bits.edf but preserved for implementation. [C:/Users/Ziyueshi/vivado/ALU_4bits/ALU_4bits.runs/synth_1/ALU_4bits/ALU_4bits.edf:932]
WARNING: [Constraints 18-550] Could not create 'IOSTANDARD' constraint because net 'U1/a_to_g[1]' is not directly connected to top level port. Synthesis is ignored for C:/Users/Ziyueshi/vivado/ALU_4bits/ALU_4bits.runs/synth_1/ALU_4bits/ALU_4bits.edf but preserved for implementation. [C:/Users/Ziyueshi/vivado/ALU_4bits/ALU_4bits.runs/synth_1/ALU_4bits/ALU_4bits.edf:940]
WARNING: [Constraints 18-550] Could not create 'IOSTANDARD' constraint because net 'U1/a_to_g[2]' is not directly connected to top level port. Synthesis is ignored for C:/Users/Ziyueshi/vivado/ALU_4bits/ALU_4bits.runs/synth_1/ALU_4bits/ALU_4bits.edf but preserved for implementation. [C:/Users/Ziyueshi/vivado/ALU_4bits/ALU_4bits.runs/synth_1/ALU_4bits/ALU_4bits.edf:948]
WARNING: [Constraints 18-550] Could not create 'IOSTANDARD' constraint because net 'U1/a_to_g[3]' is not directly connected to top level port. Synthesis is ignored for C:/Users/Ziyueshi/vivado/ALU_4bits/ALU_4bits.runs/synth_1/ALU_4bits/ALU_4bits.edf but preserved for implementation. [C:/Users/Ziyueshi/vivado/ALU_4bits/ALU_4bits.runs/synth_1/ALU_4bits/ALU_4bits.edf:956]
WARNING: [Constraints 18-550] Could not create 'IOSTANDARD' constraint because net 'U1/a_to_g[4]' is not directly connected to top level port. Synthesis is ignored for C:/Users/Ziyueshi/vivado/ALU_4bits/ALU_4bits.runs/synth_1/ALU_4bits/ALU_4bits.edf but preserved for implementation. [C:/Users/Ziyueshi/vivado/ALU_4bits/ALU_4bits.runs/synth_1/ALU_4bits/ALU_4bits.edf:964]
WARNING: [Constraints 18-550] Could not create 'IOSTANDARD' constraint because net 'U1/a_to_g[5]' is not directly connected to top level port. Synthesis is ignored for C:/Users/Ziyueshi/vivado/ALU_4bits/ALU_4bits.runs/synth_1/ALU_4bits/ALU_4bits.edf but preserved for implementation. [C:/Users/Ziyueshi/vivado/ALU_4bits/ALU_4bits.runs/synth_1/ALU_4bits/ALU_4bits.edf:972]
WARNING: [Constraints 18-550] Could not create 'IOSTANDARD' constraint because net 'U1/a_to_g[6]' is not directly connected to top level port. Synthesis is ignored for C:/Users/Ziyueshi/vivado/ALU_4bits/ALU_4bits.runs/synth_1/ALU_4bits/ALU_4bits.edf but preserved for implementation. [C:/Users/Ziyueshi/vivado/ALU_4bits/ALU_4bits.runs/synth_1/ALU_4bits/ALU_4bits.edf:980]
WARNING: [Constraints 18-550] Could not create 'IOSTANDARD' constraint because net 'U1/an[0]' is not directly connected to top level port. Synthesis is ignored for C:/Users/Ziyueshi/vivado/ALU_4bits/ALU_4bits.runs/synth_1/ALU_4bits/ALU_4bits.edf but preserved for implementation. [C:/Users/Ziyueshi/vivado/ALU_4bits/ALU_4bits.runs/synth_1/ALU_4bits/ALU_4bits.edf:989]
WARNING: [Constraints 18-550] Could not create 'IOSTANDARD' constraint because net 'U1/an[1]' is not directly connected to top level port. Synthesis is ignored for C:/Users/Ziyueshi/vivado/ALU_4bits/ALU_4bits.runs/synth_1/ALU_4bits/ALU_4bits.edf but preserved for implementation. [C:/Users/Ziyueshi/vivado/ALU_4bits/ALU_4bits.runs/synth_1/ALU_4bits/ALU_4bits.edf:1009]
WARNING: [Constraints 18-550] Could not create 'IOSTANDARD' constraint because net 'U1/sys_clk' is not directly connected to top level port. Synthesis is ignored for C:/Users/Ziyueshi/vivado/ALU_4bits/ALU_4bits.runs/synth_1/ALU_4bits/ALU_4bits.edf but preserved for implementation. [C:/Users/Ziyueshi/vivado/ALU_4bits/ALU_4bits.runs/synth_1/ALU_4bits/ALU_4bits.edf:837]
WARNING: [Constraints 18-550] Could not create 'IOSTANDARD' constraint because net 'U1/sys_rst_n' is not directly connected to top level port. Synthesis is ignored for C:/Users/Ziyueshi/vivado/ALU_4bits/ALU_4bits.runs/synth_1/ALU_4bits/ALU_4bits.edf but preserved for implementation. [C:/Users/Ziyueshi/vivado/ALU_4bits/ALU_4bits.runs/synth_1/ALU_4bits/ALU_4bits.edf:845]
Parsing XDC File [C:/Users/Ziyueshi/vivado/ALU_4bits/ALU_4bits.srcs/constrs_1/imports/DLC/pin.xdc]
Finished Parsing XDC File [C:/Users/Ziyueshi/vivado/ALU_4bits/ALU_4bits.srcs/constrs_1/imports/DLC/pin.xdc]
INFO: [Opt 31-138] Pushed 0 inverter(s) to 0 load pin(s).
INFO: [Project 1-111] Unisim Transformation Summary:
No Unisim elements were transformed.

7 Infos, 21 Warnings, 0 Critical Warnings and 0 Errors encountered.
link_design completed successfully
link_design: Time (s): cpu = 00:00:06 ; elapsed = 00:00:08 . Memory (MB): peak = 547.703 ; gain = 319.051
Command: opt_design
Attempting to get a license for feature 'Implementation' and/or device 'xc7a35t'
INFO: [Common 17-349] Got license for feature 'Implementation' and/or device 'xc7a35t'
Running DRC as a precondition to command opt_design

Starting DRC Task
INFO: [DRC 23-27] Running DRC with 2 threads
INFO: [Project 1-461] DRC finished with 0 Errors
INFO: [Project 1-462] Please refer to the DRC report (report_drc) for more information.

Time (s): cpu = 00:00:01 ; elapsed = 00:00:00.613 . Memory (MB): peak = 559.172 ; gain = 11.469

Starting Cache Timing Information Task
INFO: [Timing 38-35] Done setting XDC timing constraints.
Ending Cache Timing Information Task | Checksum: 191d0f1e1

Time (s): cpu = 00:00:09 ; elapsed = 00:00:11 . Memory (MB): peak = 1115.070 ; gain = 555.898

Starting Logic Optimization Task

Phase 1 Retarget
INFO: [Opt 31-138] Pushed 0 inverter(s) to 0 load pin(s).
INFO: [Opt 31-49] Retargeted 0 cell(s).
Phase 1 Retarget | Checksum: 191d0f1e1

Time (s): cpu = 00:00:00 ; elapsed = 00:00:00.022 . Memory (MB): peak = 1115.070 ; gain = 0.000
INFO: [Opt 31-389] Phase Retarget created 0 cells and removed 0 cells

Phase 2 Constant propagation
INFO: [Opt 31-138] Pushed 0 inverter(s) to 0 load pin(s).
Phase 2 Constant propagation | Checksum: 19efc7c60

Time (s): cpu = 00:00:00 ; elapsed = 00:00:00.029 . Memory (MB): peak = 1115.070 ; gain = 0.000
INFO: [Opt 31-389] Phase Constant propagation created 0 cells and removed 0 cells

Phase 3 Sweep
Phase 3 Sweep | Checksum: 1b213ad7c

Time (s): cpu = 00:00:00 ; elapsed = 00:00:00.038 . Memory (MB): peak = 1115.070 ; gain = 0.000
INFO: [Opt 31-389] Phase Sweep created 0 cells and removed 0 cells

Phase 4 BUFG optimization
Phase 4 BUFG optimization | Checksum: 1b213ad7c

Time (s): cpu = 00:00:00 ; elapsed = 00:00:00.047 . Memory (MB): peak = 1115.070 ; gain = 0.000
INFO: [Opt 31-662] Phase BUFG optimization created 0 cells of which 0 are BUFGs and removed 0 cells.

Phase 5 Shift Register Optimization
Phase 5 Shift Register Optimization | Checksum: 1742f044a

Time (s): cpu = 00:00:00 ; elapsed = 00:00:00.056 . Memory (MB): peak = 1115.070 ; gain = 0.000
INFO: [Opt 31-389] Phase Shift Register Optimization created 0 cells and removed 0 cells

Phase 6 Post Processing Netlist
Phase 6 Post Processing Netlist | Checksum: 1742f044a

Time (s): cpu = 00:00:00 ; elapsed = 00:00:00.058 . Memory (MB): peak = 1115.070 ; gain = 0.000
INFO: [Opt 31-389] Phase Post Processing Netlist created 0 cells and removed 0 cells

Starting Connectivity Check Task

Time (s): cpu = 00:00:00 ; elapsed = 00:00:00.001 . Memory (MB): peak = 1115.070 ; gain = 0.000
Ending Logic Optimization Task | Checksum: 1742f044a

Time (s): cpu = 00:00:00 ; elapsed = 00:00:00.060 . Memory (MB): peak = 1115.070 ; gain = 0.000

Starting Power Optimization Task
INFO: [Pwropt 34-132] Skipping clock gating for clocks with a period < 2.00 ns.
Ending Power Optimization Task | Checksum: 1742f044a

Time (s): cpu = 00:00:00 ; elapsed = 00:00:00.008 . Memory (MB): peak = 1115.070 ; gain = 0.000

Starting Final Cleanup Task
Ending Final Cleanup Task | Checksum: 1742f044a

Time (s): cpu = 00:00:00 ; elapsed = 00:00:00 . Memory (MB): peak = 1115.070 ; gain = 0.000
INFO: [Common 17-83] Releasing license: Implementation
23 Infos, 21 Warnings, 0 Critical Warnings and 0 Errors encountered.
opt_design completed successfully
opt_design: Time (s): cpu = 00:00:10 ; elapsed = 00:00:12 . Memory (MB): peak = 1115.070 ; gain = 567.367
INFO: [Timing 38-480] Writing timing data to binary archive.
Writing placer database...
Writing XDEF routing.
Writing XDEF routing logical nets.
Writing XDEF routing special nets.
Write XDEF Complete: Time (s): cpu = 00:00:00 ; elapsed = 00:00:00.035 . Memory (MB): peak = 1115.070 ; gain = 0.000
INFO: [Common 17-1381] The checkpoint 'C:/Users/Ziyueshi/vivado/ALU_4bits/ALU_4bits.runs/impl_1/ALU_4bits_opt.dcp' has been generated.
INFO: [runtcl-4] Executing : report_drc -file ALU_4bits_drc_opted.rpt -pb ALU_4bits_drc_opted.pb -rpx ALU_4bits_drc_opted.rpx
Command: report_drc -file ALU_4bits_drc_opted.rpt -pb ALU_4bits_drc_opted.pb -rpx ALU_4bits_drc_opted.rpx
INFO: [IP_Flow 19-234] Refreshing IP repositories
INFO: [IP_Flow 19-1704] No user IP repositories specified
INFO: [IP_Flow 19-2313] Loaded Vivado IP repository 'D:/Vivado/2018.2/data/ip'.
INFO: [DRC 23-27] Running DRC with 2 threads
INFO: [Coretcl 2-168] The results of DRC are in file C:/Users/Ziyueshi/vivado/ALU_4bits/ALU_4bits.runs/impl_1/ALU_4bits_drc_opted.rpt.
report_drc completed successfully
Command: place_design
Attempting to get a license for feature 'Implementation' and/or device 'xc7a35t'
INFO: [Common 17-349] Got license for feature 'Implementation' and/or device 'xc7a35t'
INFO: [DRC 23-27] Running DRC with 2 threads
INFO: [Vivado_Tcl 4-198] DRC finished with 0 Errors
INFO: [Vivado_Tcl 4-199] Please refer to the DRC report (report_drc) for more information.
Running DRC as a precondition to command place_design
INFO: [DRC 23-27] Running DRC with 2 threads
INFO: [Vivado_Tcl 4-198] DRC finished with 0 Errors
INFO: [Vivado_Tcl 4-199] Please refer to the DRC report (report_drc) for more information.

Starting Placer Task
INFO: [Place 30-611] Multithreading enabled for place_design using a maximum of 2 CPUs

Phase 1 Placer Initialization

Phase 1.1 Placer Initialization Netlist Sorting
Netlist sorting complete. Time (s): cpu = 00:00:00 ; elapsed = 00:00:00.001 . Memory (MB): peak = 1115.070 ; gain = 0.000
Phase 1.1 Placer Initialization Netlist Sorting | Checksum: e7f1c57a

Time (s): cpu = 00:00:00 ; elapsed = 00:00:00.009 . Memory (MB): peak = 1115.070 ; gain = 0.000
Netlist sorting complete. Time (s): cpu = 00:00:00 ; elapsed = 00:00:00.001 . Memory (MB): peak = 1115.070 ; gain = 0.000

Phase 1.2 IO Placement/ Clock Placement/ Build Placer Device
INFO: [Timing 38-35] Done setting XDC timing constraints.
Phase 1.2 IO Placement/ Clock Placement/ Build Placer Device | Checksum: 5dbd0531

Time (s): cpu = 00:00:00 ; elapsed = 00:00:00.547 . Memory (MB): peak = 1115.070 ; gain = 0.000

Phase 1.3 Build Placer Netlist Model
Phase 1.3 Build Placer Netlist Model | Checksum: 12ea36a00

Time (s): cpu = 00:00:00 ; elapsed = 00:00:00.590 . Memory (MB): peak = 1115.070 ; gain = 0.000

Phase 1.4 Constrain Clocks/Macros
Phase 1.4 Constrain Clocks/Macros | Checksum: 12ea36a00

Time (s): cpu = 00:00:00 ; elapsed = 00:00:00.593 . Memory (MB): peak = 1115.070 ; gain = 0.000
Phase 1 Placer Initialization | Checksum: 12ea36a00

Time (s): cpu = 00:00:00 ; elapsed = 00:00:00.596 . Memory (MB): peak = 1115.070 ; gain = 0.000

Phase 2 Global Placement

Phase 2.1 Floorplanning
Phase 2.1 Floorplanning | Checksum: 12ea36a00

Time (s): cpu = 00:00:00 ; elapsed = 00:00:00.618 . Memory (MB): peak = 1115.070 ; gain = 0.000
WARNING: [Place 46-29] place_design is not in timing mode. Skip physical synthesis in placer
Phase 2 Global Placement | Checksum: c4cca4ff

Time (s): cpu = 00:00:01 ; elapsed = 00:00:01 . Memory (MB): peak = 1115.070 ; gain = 0.000

Phase 3 Detail Placement

Phase 3.1 Commit Multi Column Macros
Phase 3.1 Commit Multi Column Macros | Checksum: c4cca4ff

Time (s): cpu = 00:00:01 ; elapsed = 00:00:01 . Memory (MB): peak = 1115.070 ; gain = 0.000

Phase 3.2 Commit Most Macros & LUTRAMs
Phase 3.2 Commit Most Macros & LUTRAMs | Checksum: 1971ccfbb

Time (s): cpu = 00:00:01 ; elapsed = 00:00:01 . Memory (MB): peak = 1115.070 ; gain = 0.000

Phase 3.3 Area Swap Optimization
Phase 3.3 Area Swap Optimization | Checksum: 12e0dbd9f

Time (s): cpu = 00:00:01 ; elapsed = 00:00:01 . Memory (MB): peak = 1115.070 ; gain = 0.000

Phase 3.4 Pipeline Register Optimization
Phase 3.4 Pipeline Register Optimization | Checksum: 12e0dbd9f

Time (s): cpu = 00:00:01 ; elapsed = 00:00:01 . Memory (MB): peak = 1115.070 ; gain = 0.000

Phase 3.5 Small Shape Detail Placement
Phase 3.5 Small Shape Detail Placement | Checksum: 119795455

Time (s): cpu = 00:00:02 ; elapsed = 00:00:01 . Memory (MB): peak = 1115.070 ; gain = 0.000

Phase 3.6 Re-assign LUT pins
Phase 3.6 Re-assign LUT pins | Checksum: 119795455

Time (s): cpu = 00:00:02 ; elapsed = 00:00:01 . Memory (MB): peak = 1115.070 ; gain = 0.000

Phase 3.7 Pipeline Register Optimization
Phase 3.7 Pipeline Register Optimization | Checksum: 119795455

Time (s): cpu = 00:00:02 ; elapsed = 00:00:01 . Memory (MB): peak = 1115.070 ; gain = 0.000
Phase 3 Detail Placement | Checksum: 119795455

Time (s): cpu = 00:00:02 ; elapsed = 00:00:01 . Memory (MB): peak = 1115.070 ; gain = 0.000

Phase 4 Post Placement Optimization and Clean-Up

Phase 4.1 Post Commit Optimization
Phase 4.1 Post Commit Optimization | Checksum: 119795455

Time (s): cpu = 00:00:02 ; elapsed = 00:00:01 . Memory (MB): peak = 1115.070 ; gain = 0.000

Phase 4.2 Post Placement Cleanup
Phase 4.2 Post Placement Cleanup | Checksum: 119795455

Time (s): cpu = 00:00:02 ; elapsed = 00:00:01 . Memory (MB): peak = 1115.070 ; gain = 0.000

Phase 4.3 Placer Reporting
Phase 4.3 Placer Reporting | Checksum: 119795455

Time (s): cpu = 00:00:02 ; elapsed = 00:00:01 . Memory (MB): peak = 1115.070 ; gain = 0.000

Phase 4.4 Final Placement Cleanup
Phase 4.4 Final Placement Cleanup | Checksum: 1a3ae149e

Time (s): cpu = 00:00:02 ; elapsed = 00:00:01 . Memory (MB): peak = 1115.070 ; gain = 0.000
Phase 4 Post Placement Optimization and Clean-Up | Checksum: 1a3ae149e

Time (s): cpu = 00:00:02 ; elapsed = 00:00:01 . Memory (MB): peak = 1115.070 ; gain = 0.000
Ending Placer Task | Checksum: e4bb95e1

Time (s): cpu = 00:00:02 ; elapsed = 00:00:01 . Memory (MB): peak = 1115.070 ; gain = 0.000
INFO: [Common 17-83] Releasing license: Implementation
41 Infos, 22 Warnings, 0 Critical Warnings and 0 Errors encountered.
place_design completed successfully
INFO: [Timing 38-480] Writing timing data to binary archive.
Writing placer database...
Writing XDEF routing.
Writing XDEF routing logical nets.
Writing XDEF routing special nets.
Write XDEF Complete: Time (s): cpu = 00:00:00 ; elapsed = 00:00:00.048 . Memory (MB): peak = 1115.070 ; gain = 0.000
INFO: [Common 17-1381] The checkpoint 'C:/Users/Ziyueshi/vivado/ALU_4bits/ALU_4bits.runs/impl_1/ALU_4bits_placed.dcp' has been generated.
INFO: [runtcl-4] Executing : report_io -file ALU_4bits_io_placed.rpt
report_io: Time (s): cpu = 00:00:00 ; elapsed = 00:00:00.044 . Memory (MB): peak = 1120.164 ; gain = 0.000
INFO: [runtcl-4] Executing : report_utilization -file ALU_4bits_utilization_placed.rpt -pb ALU_4bits_utilization_placed.pb
report_utilization: Time (s): cpu = 00:00:00 ; elapsed = 00:00:00.029 . Memory (MB): peak = 1120.164 ; gain = 0.000
INFO: [runtcl-4] Executing : report_control_sets -verbose -file ALU_4bits_control_sets_placed.rpt
report_control_sets: Time (s): cpu = 00:00:00 ; elapsed = 00:00:00.002 . Memory (MB): peak = 1120.164 ; gain = 0.000
Command: route_design
Attempting to get a license for feature 'Implementation' and/or device 'xc7a35t'
INFO: [Common 17-349] Got license for feature 'Implementation' and/or device 'xc7a35t'
Running DRC as a precondition to command route_design
INFO: [DRC 23-27] Running DRC with 2 threads
INFO: [Vivado_Tcl 4-198] DRC finished with 0 Errors
INFO: [Vivado_Tcl 4-199] Please refer to the DRC report (report_drc) for more information.


Starting Routing Task
INFO: [Route 35-254] Multithreading enabled for route_design using a maximum of 2 CPUs
Checksum: PlaceDB: 3c033b36 ConstDB: 0 ShapeSum: a8b85aab RouteDB: 0

Phase 1 Build RT Design
Phase 1 Build RT Design | Checksum: e0860547

Time (s): cpu = 00:00:20 ; elapsed = 00:00:18 . Memory (MB): peak = 1237.734 ; gain = 117.570
Post Restoration Checksum: NetGraph: 17f271e2 NumContArr: c8939365 Constraints: 0 Timing: 0

Phase 2 Router Initialization
INFO: [Route 35-64] No timing constraints were detected. The router will operate in resource-optimization mode.

Phase 2.1 Fix Topology Constraints
Phase 2.1 Fix Topology Constraints | Checksum: e0860547

Time (s): cpu = 00:00:21 ; elapsed = 00:00:18 . Memory (MB): peak = 1243.738 ; gain = 123.574

Phase 2.2 Pre Route Cleanup
Phase 2.2 Pre Route Cleanup | Checksum: e0860547

Time (s): cpu = 00:00:21 ; elapsed = 00:00:18 . Memory (MB): peak = 1243.738 ; gain = 123.574
 Number of Nodes with overlaps = 0
Phase 2 Router Initialization | Checksum: 1c3ebd2dc

Time (s): cpu = 00:00:21 ; elapsed = 00:00:18 . Memory (MB): peak = 1245.547 ; gain = 125.383

Phase 3 Initial Routing
Phase 3 Initial Routing | Checksum: 7aa7c49a

Time (s): cpu = 00:00:21 ; elapsed = 00:00:18 . Memory (MB): peak = 1245.547 ; gain = 125.383

Phase 4 Rip-up And Reroute

Phase 4.1 Global Iteration 0
 Number of Nodes with overlaps = 20
 Number of Nodes with overlaps = 0
Phase 4.1 Global Iteration 0 | Checksum: 1844d9847

Time (s): cpu = 00:00:21 ; elapsed = 00:00:18 . Memory (MB): peak = 1245.570 ; gain = 125.406
Phase 4 Rip-up And Reroute | Checksum: 1844d9847

Time (s): cpu = 00:00:21 ; elapsed = 00:00:18 . Memory (MB): peak = 1245.570 ; gain = 125.406

Phase 5 Delay and Skew Optimization
Phase 5 Delay and Skew Optimization | Checksum: 1844d9847

Time (s): cpu = 00:00:21 ; elapsed = 00:00:18 . Memory (MB): peak = 1245.570 ; gain = 125.406

Phase 6 Post Hold Fix

Phase 6.1 Hold Fix Iter
Phase 6.1 Hold Fix Iter | Checksum: 1844d9847

Time (s): cpu = 00:00:21 ; elapsed = 00:00:18 . Memory (MB): peak = 1245.570 ; gain = 125.406
Phase 6 Post Hold Fix | Checksum: 1844d9847

Time (s): cpu = 00:00:21 ; elapsed = 00:00:18 . Memory (MB): peak = 1245.570 ; gain = 125.406

Phase 7 Route finalize

Router Utilization Summary
  Global Vertical Routing Utilization    = 0.0758989 %
  Global Horizontal Routing Utilization  = 0.0493233 %
  Routable Net Status*
  *Does not include unroutable nets such as driverless and loadless.
  Run report_route_status for detailed report.
  Number of Failed Nets               = 0
  Number of Unrouted Nets             = 0
  Number of Partially Routed Nets     = 0
  Number of Node Overlaps             = 0

Congestion Report
North Dir 1x1 Area, Max Cong = 21.6216%, No Congested Regions.
South Dir 1x1 Area, Max Cong = 17.1171%, No Congested Regions.
East Dir 1x1 Area, Max Cong = 22.0588%, No Congested Regions.
West Dir 1x1 Area, Max Cong = 14.7059%, No Congested Regions.

------------------------------
Reporting congestion hotspots
------------------------------
Direction: North
----------------
Congested clusters found at Level 0
Effective congestion level: 0 Aspect Ratio: 1 Sparse Ratio: 0
Direction: South
----------------
Congested clusters found at Level 0
Effective congestion level: 0 Aspect Ratio: 1 Sparse Ratio: 0
Direction: East
----------------
Congested clusters found at Level 0
Effective congestion level: 0 Aspect Ratio: 1 Sparse Ratio: 0
Direction: West
----------------
Congested clusters found at Level 0
Effective congestion level: 0 Aspect Ratio: 1 Sparse Ratio: 0

Phase 7 Route finalize | Checksum: 1844d9847

Time (s): cpu = 00:00:21 ; elapsed = 00:00:19 . Memory (MB): peak = 1245.570 ; gain = 125.406

Phase 8 Verifying routed nets

 Verification completed successfully
Phase 8 Verifying routed nets | Checksum: 1844d9847

Time (s): cpu = 00:00:21 ; elapsed = 00:00:19 . Memory (MB): peak = 1247.598 ; gain = 127.434

Phase 9 Depositing Routes
Phase 9 Depositing Routes | Checksum: be4f6349

Time (s): cpu = 00:00:21 ; elapsed = 00:00:19 . Memory (MB): peak = 1247.598 ; gain = 127.434
INFO: [Route 35-16] Router Completed Successfully

Time (s): cpu = 00:00:21 ; elapsed = 00:00:19 . Memory (MB): peak = 1247.598 ; gain = 127.434

Routing Is Done.
INFO: [Common 17-83] Releasing license: Implementation
54 Infos, 22 Warnings, 0 Critical Warnings and 0 Errors encountered.
route_design completed successfully
route_design: Time (s): cpu = 00:00:22 ; elapsed = 00:00:19 . Memory (MB): peak = 1247.598 ; gain = 127.434
INFO: [Timing 38-480] Writing timing data to binary archive.
Writing placer database...
Writing XDEF routing.
Writing XDEF routing logical nets.
Writing XDEF routing special nets.
Write XDEF Complete: Time (s): cpu = 00:00:00 ; elapsed = 00:00:00.052 . Memory (MB): peak = 1247.598 ; gain = 0.000
INFO: [Common 17-1381] The checkpoint 'C:/Users/Ziyueshi/vivado/ALU_4bits/ALU_4bits.runs/impl_1/ALU_4bits_routed.dcp' has been generated.
INFO: [runtcl-4] Executing : report_drc -file ALU_4bits_drc_routed.rpt -pb ALU_4bits_drc_routed.pb -rpx ALU_4bits_drc_routed.rpx
Command: report_drc -file ALU_4bits_drc_routed.rpt -pb ALU_4bits_drc_routed.pb -rpx ALU_4bits_drc_routed.rpx
INFO: [DRC 23-27] Running DRC with 2 threads
INFO: [Coretcl 2-168] The results of DRC are in file C:/Users/Ziyueshi/vivado/ALU_4bits/ALU_4bits.runs/impl_1/ALU_4bits_drc_routed.rpt.
report_drc completed successfully
INFO: [runtcl-4] Executing : report_methodology -file ALU_4bits_methodology_drc_routed.rpt -pb ALU_4bits_methodology_drc_routed.pb -rpx ALU_4bits_methodology_drc_routed.rpx
Command: report_methodology -file ALU_4bits_methodology_drc_routed.rpt -pb ALU_4bits_methodology_drc_routed.pb -rpx ALU_4bits_methodology_drc_routed.rpx
INFO: [Timing 38-35] Done setting XDC timing constraints.
INFO: [Timing 38-35] Done setting XDC timing constraints.
INFO: [DRC 23-133] Running Methodology with 2 threads
INFO: [Coretcl 2-1520] The results of Report Methodology are in file C:/Users/Ziyueshi/vivado/ALU_4bits/ALU_4bits.runs/impl_1/ALU_4bits_methodology_drc_routed.rpt.
report_methodology completed successfully
INFO: [runtcl-4] Executing : report_power -file ALU_4bits_power_routed.rpt -pb ALU_4bits_power_summary_routed.pb -rpx ALU_4bits_power_routed.rpx
Command: report_power -file ALU_4bits_power_routed.rpt -pb ALU_4bits_power_summary_routed.pb -rpx ALU_4bits_power_routed.rpx
WARNING: [Power 33-232] No user defined clocks were found in the design!
Resolution: Please specify clocks using create_clock/create_generated_clock for sequential elements. For pure combinatorial circuits, please specify a virtual clock, otherwise the vectorless estimation might be inaccurate
INFO: [Timing 38-35] Done setting XDC timing constraints.
Running Vector-less Activity Propagation...

Finished Running Vector-less Activity Propagation
66 Infos, 23 Warnings, 0 Critical Warnings and 0 Errors encountered.
report_power completed successfully
INFO: [runtcl-4] Executing : report_route_status -file ALU_4bits_route_status.rpt -pb ALU_4bits_route_status.pb
INFO: [runtcl-4] Executing : report_timing_summary -max_paths 10 -file ALU_4bits_timing_summary_routed.rpt -pb ALU_4bits_timing_summary_routed.pb -rpx ALU_4bits_timing_summary_routed.rpx -warn_on_violation 
INFO: [Timing 38-91] UpdateTimingParams: Speed grade: -1, Delay Type: min_max, Timing Stage: Requireds.
INFO: [Timing 38-191] Multithreading enabled for timing update using a maximum of 2 CPUs
WARNING: [Timing 38-313] There are no user specified timing constraints. Timing constraints are needed for proper timing analysis.
INFO: [runtcl-4] Executing : report_incremental_reuse -file ALU_4bits_incremental_reuse_routed.rpt
INFO: [Vivado_Tcl 4-545] No incremental reuse to report, no incremental placement and routing data was found.
INFO: [runtcl-4] Executing : report_clock_utilization -file ALU_4bits_clock_utilization_routed.rpt
INFO: [Common 17-206] Exiting Vivado at Sun May  8 12:04:37 2022...

*** Running vivado
    with args -log ALU_4bits.vdi -applog -m64 -product Vivado -messageDb vivado.pb -mode batch -source ALU_4bits.tcl -notrace


****** Vivado v2018.2 (64-bit)
  **** SW Build 2258646 on Thu Jun 14 20:03:12 MDT 2018
  **** IP Build 2256618 on Thu Jun 14 22:10:49 MDT 2018
    ** Copyright 1986-2018 Xilinx, Inc. All Rights Reserved.

source ALU_4bits.tcl -notrace
Command: open_checkpoint ALU_4bits_routed.dcp

Starting open_checkpoint Task

Time (s): cpu = 00:00:00 ; elapsed = 00:00:00.037 . Memory (MB): peak = 226.121 ; gain = 0.000
INFO: [Netlist 29-17] Analyzing 28 Unisim elements for replacement
INFO: [Netlist 29-28] Unisim Transformation completed in 0 CPU seconds
INFO: [Project 1-479] Netlist was created with Vivado 2018.2
INFO: [Device 21-403] Loading part xc7a35tftg256-1
INFO: [Project 1-570] Preparing netlist for logic optimization
WARNING: [Constraints 18-550] Could not create 'IOSTANDARD' constraint because net 'U1/<const0>' is not directly connected to top level port. Synthesis is ignored for C:/Users/Ziyueshi/vivado/ALU_4bits/ALU_4bits.runs/synth_1/ALU_4bits/ALU_4bits.edf but preserved for implementation. [C:/Users/Ziyueshi/vivado/ALU_4bits/ALU_4bits.runs/synth_1/ALU_4bits/ALU_4bits.edf:487]
WARNING: [Constraints 18-550] Could not create 'IOSTANDARD' constraint because net 'U1/<const1>' is not directly connected to top level port. Synthesis is ignored for C:/Users/Ziyueshi/vivado/ALU_4bits/ALU_4bits.runs/synth_1/ALU_4bits/ALU_4bits.edf but preserved for implementation. [C:/Users/Ziyueshi/vivado/ALU_4bits/ALU_4bits.runs/synth_1/ALU_4bits/ALU_4bits.edf:517]
WARNING: [Constraints 18-550] Could not create 'IOSTANDARD' constraint because net 'U1/Y0[0]' is not directly connected to top level port. Synthesis is ignored for C:/Users/Ziyueshi/vivado/ALU_4bits/ALU_4bits.runs/synth_1/ALU_4bits/ALU_4bits.edf but preserved for implementation. [C:/Users/Ziyueshi/vivado/ALU_4bits/ALU_4bits.runs/synth_1/ALU_4bits/ALU_4bits.edf:860]
WARNING: [Constraints 18-550] Could not create 'IOSTANDARD' constraint because net 'U1/Y0[1]' is not directly connected to top level port. Synthesis is ignored for C:/Users/Ziyueshi/vivado/ALU_4bits/ALU_4bits.runs/synth_1/ALU_4bits/ALU_4bits.edf but preserved for implementation. [C:/Users/Ziyueshi/vivado/ALU_4bits/ALU_4bits.runs/synth_1/ALU_4bits/ALU_4bits.edf:868]
WARNING: [Constraints 18-550] Could not create 'IOSTANDARD' constraint because net 'U1/Y0[2]' is not directly connected to top level port. Synthesis is ignored for C:/Users/Ziyueshi/vivado/ALU_4bits/ALU_4bits.runs/synth_1/ALU_4bits/ALU_4bits.edf but preserved for implementation. [C:/Users/Ziyueshi/vivado/ALU_4bits/ALU_4bits.runs/synth_1/ALU_4bits/ALU_4bits.edf:876]
WARNING: [Constraints 18-550] Could not create 'IOSTANDARD' constraint because net 'U1/Y0[3]' is not directly connected to top level port. Synthesis is ignored for C:/Users/Ziyueshi/vivado/ALU_4bits/ALU_4bits.runs/synth_1/ALU_4bits/ALU_4bits.edf but preserved for implementation. [C:/Users/Ziyueshi/vivado/ALU_4bits/ALU_4bits.runs/synth_1/ALU_4bits/ALU_4bits.edf:884]
WARNING: [Constraints 18-550] Could not create 'IOSTANDARD' constraint because net 'U1/Y1[0]' is not directly connected to top level port. Synthesis is ignored for C:/Users/Ziyueshi/vivado/ALU_4bits/ALU_4bits.runs/synth_1/ALU_4bits/ALU_4bits.edf but preserved for implementation. [C:/Users/Ziyueshi/vivado/ALU_4bits/ALU_4bits.runs/synth_1/ALU_4bits/ALU_4bits.edf:899]
WARNING: [Constraints 18-550] Could not create 'IOSTANDARD' constraint because net 'U1/Y1[1]' is not directly connected to top level port. Synthesis is ignored for C:/Users/Ziyueshi/vivado/ALU_4bits/ALU_4bits.runs/synth_1/ALU_4bits/ALU_4bits.edf but preserved for implementation. [C:/Users/Ziyueshi/vivado/ALU_4bits/ALU_4bits.runs/synth_1/ALU_4bits/ALU_4bits.edf:907]
WARNING: [Constraints 18-550] Could not create 'IOSTANDARD' constraint because net 'U1/Y1[2]' is not directly connected to top level port. Synthesis is ignored for C:/Users/Ziyueshi/vivado/ALU_4bits/ALU_4bits.runs/synth_1/ALU_4bits/ALU_4bits.edf but preserved for implementation. [C:/Users/Ziyueshi/vivado/ALU_4bits/ALU_4bits.runs/synth_1/ALU_4bits/ALU_4bits.edf:915]
WARNING: [Constraints 18-550] Could not create 'IOSTANDARD' constraint because net 'U1/Y1[3]' is not directly connected to top level port. Synthesis is ignored for C:/Users/Ziyueshi/vivado/ALU_4bits/ALU_4bits.runs/synth_1/ALU_4bits/ALU_4bits.edf but preserved for implementation. [C:/Users/Ziyueshi/vivado/ALU_4bits/ALU_4bits.runs/synth_1/ALU_4bits/ALU_4bits.edf:923]
WARNING: [Constraints 18-550] Could not create 'IOSTANDARD' constraint because net 'U1/a_to_g[0]' is not directly connected to top level port. Synthesis is ignored for C:/Users/Ziyueshi/vivado/ALU_4bits/ALU_4bits.runs/synth_1/ALU_4bits/ALU_4bits.edf but preserved for implementation. [C:/Users/Ziyueshi/vivado/ALU_4bits/ALU_4bits.runs/synth_1/ALU_4bits/ALU_4bits.edf:932]
WARNING: [Constraints 18-550] Could not create 'IOSTANDARD' constraint because net 'U1/a_to_g[1]' is not directly connected to top level port. Synthesis is ignored for C:/Users/Ziyueshi/vivado/ALU_4bits/ALU_4bits.runs/synth_1/ALU_4bits/ALU_4bits.edf but preserved for implementation. [C:/Users/Ziyueshi/vivado/ALU_4bits/ALU_4bits.runs/synth_1/ALU_4bits/ALU_4bits.edf:940]
WARNING: [Constraints 18-550] Could not create 'IOSTANDARD' constraint because net 'U1/a_to_g[2]' is not directly connected to top level port. Synthesis is ignored for C:/Users/Ziyueshi/vivado/ALU_4bits/ALU_4bits.runs/synth_1/ALU_4bits/ALU_4bits.edf but preserved for implementation. [C:/Users/Ziyueshi/vivado/ALU_4bits/ALU_4bits.runs/synth_1/ALU_4bits/ALU_4bits.edf:948]
WARNING: [Constraints 18-550] Could not create 'IOSTANDARD' constraint because net 'U1/a_to_g[3]' is not directly connected to top level port. Synthesis is ignored for C:/Users/Ziyueshi/vivado/ALU_4bits/ALU_4bits.runs/synth_1/ALU_4bits/ALU_4bits.edf but preserved for implementation. [C:/Users/Ziyueshi/vivado/ALU_4bits/ALU_4bits.runs/synth_1/ALU_4bits/ALU_4bits.edf:956]
WARNING: [Constraints 18-550] Could not create 'IOSTANDARD' constraint because net 'U1/a_to_g[4]' is not directly connected to top level port. Synthesis is ignored for C:/Users/Ziyueshi/vivado/ALU_4bits/ALU_4bits.runs/synth_1/ALU_4bits/ALU_4bits.edf but preserved for implementation. [C:/Users/Ziyueshi/vivado/ALU_4bits/ALU_4bits.runs/synth_1/ALU_4bits/ALU_4bits.edf:964]
WARNING: [Constraints 18-550] Could not create 'IOSTANDARD' constraint because net 'U1/a_to_g[5]' is not directly connected to top level port. Synthesis is ignored for C:/Users/Ziyueshi/vivado/ALU_4bits/ALU_4bits.runs/synth_1/ALU_4bits/ALU_4bits.edf but preserved for implementation. [C:/Users/Ziyueshi/vivado/ALU_4bits/ALU_4bits.runs/synth_1/ALU_4bits/ALU_4bits.edf:972]
WARNING: [Constraints 18-550] Could not create 'IOSTANDARD' constraint because net 'U1/a_to_g[6]' is not directly connected to top level port. Synthesis is ignored for C:/Users/Ziyueshi/vivado/ALU_4bits/ALU_4bits.runs/synth_1/ALU_4bits/ALU_4bits.edf but preserved for implementation. [C:/Users/Ziyueshi/vivado/ALU_4bits/ALU_4bits.runs/synth_1/ALU_4bits/ALU_4bits.edf:980]
WARNING: [Constraints 18-550] Could not create 'IOSTANDARD' constraint because net 'U1/an[0]' is not directly connected to top level port. Synthesis is ignored for C:/Users/Ziyueshi/vivado/ALU_4bits/ALU_4bits.runs/synth_1/ALU_4bits/ALU_4bits.edf but preserved for implementation. [C:/Users/Ziyueshi/vivado/ALU_4bits/ALU_4bits.runs/synth_1/ALU_4bits/ALU_4bits.edf:989]
WARNING: [Constraints 18-550] Could not create 'IOSTANDARD' constraint because net 'U1/an[1]' is not directly connected to top level port. Synthesis is ignored for C:/Users/Ziyueshi/vivado/ALU_4bits/ALU_4bits.runs/synth_1/ALU_4bits/ALU_4bits.edf but preserved for implementation. [C:/Users/Ziyueshi/vivado/ALU_4bits/ALU_4bits.runs/synth_1/ALU_4bits/ALU_4bits.edf:1009]
WARNING: [Constraints 18-550] Could not create 'IOSTANDARD' constraint because net 'U1/sys_clk' is not directly connected to top level port. Synthesis is ignored for C:/Users/Ziyueshi/vivado/ALU_4bits/ALU_4bits.runs/synth_1/ALU_4bits/ALU_4bits.edf but preserved for implementation. [C:/Users/Ziyueshi/vivado/ALU_4bits/ALU_4bits.runs/synth_1/ALU_4bits/ALU_4bits.edf:837]
WARNING: [Constraints 18-550] Could not create 'IOSTANDARD' constraint because net 'U1/sys_rst_n' is not directly connected to top level port. Synthesis is ignored for C:/Users/Ziyueshi/vivado/ALU_4bits/ALU_4bits.runs/synth_1/ALU_4bits/ALU_4bits.edf but preserved for implementation. [C:/Users/Ziyueshi/vivado/ALU_4bits/ALU_4bits.runs/synth_1/ALU_4bits/ALU_4bits.edf:845]
INFO: [Timing 38-478] Restoring timing data from binary archive.
INFO: [Timing 38-479] Binary timing data restore complete.
INFO: [Project 1-856] Restoring constraints from binary archive.
INFO: [Project 1-853] Binary constraint restore complete.
Reading XDEF placement.
Reading placer database...
Reading XDEF routing.
Read XDEF File: Time (s): cpu = 00:00:00 ; elapsed = 00:00:00.110 . Memory (MB): peak = 1056.562 ; gain = 0.000
Restored from archive | CPU: 0.000000 secs | Memory: 0.000000 MB |
Finished XDEF File Restore: Time (s): cpu = 00:00:00 ; elapsed = 00:00:00.110 . Memory (MB): peak = 1056.562 ; gain = 0.000
INFO: [Project 1-111] Unisim Transformation Summary:
No Unisim elements were transformed.

INFO: [Project 1-604] Checkpoint was created with Vivado v2018.2 (64-bit) build 2258646
open_checkpoint: Time (s): cpu = 00:00:15 ; elapsed = 00:00:19 . Memory (MB): peak = 1056.562 ; gain = 838.898
Command: write_bitstream -force ALU_4bits.bit -bin_file
Attempting to get a license for feature 'Implementation' and/or device 'xc7a35t'
INFO: [Common 17-349] Got license for feature 'Implementation' and/or device 'xc7a35t'
Running DRC as a precondition to command write_bitstream
INFO: [IP_Flow 19-234] Refreshing IP repositories
INFO: [IP_Flow 19-1704] No user IP repositories specified
INFO: [IP_Flow 19-2313] Loaded Vivado IP repository 'D:/Vivado/2018.2/data/ip'.
INFO: [DRC 23-27] Running DRC with 2 threads
WARNING: [DRC CFGBVS-1] Missing CFGBVS and CONFIG_VOLTAGE Design Properties: Neither the CFGBVS nor CONFIG_VOLTAGE voltage property is set in the current_design.  Configuration bank voltage select (CFGBVS) must be set to VCCO or GND, and CONFIG_VOLTAGE must be set to the correct configuration voltage, in order to determine the I/O voltage support for the pins in bank 0.  It is suggested to specify these either using the 'Edit Device Properties' function in the GUI or directly in the XDC file using the following syntax:

 set_property CFGBVS value1 [current_design]
 #where value1 is either VCCO or GND

 set_property CONFIG_VOLTAGE value2 [current_design]
 #where value2 is the voltage provided to configuration bank 0

Refer to the device configuration user guide for more information.
INFO: [Vivado 12-3199] DRC finished with 0 Errors, 1 Warnings
INFO: [Vivado 12-3200] Please refer to the DRC report (report_drc) for more information.
INFO: [Designutils 20-2272] Running write_bitstream with 2 threads.
Loading data files...
Loading site data...
Loading route data...
Processing options...
Creating bitmap...
Creating bitstream...
Bitstream compression saved 14937664 bits.
Writing bitstream ./ALU_4bits.bit...
Writing bitstream ./ALU_4bits.bin...
INFO: [Vivado 12-1842] Bitgen Completed Successfully.
INFO: [Project 1-120] WebTalk data collection is mandatory when using a WebPACK part without a full Vivado license. To see the specific WebTalk data collected for your design, open the usage_statistics_webtalk.html or usage_statistics_webtalk.xml file in the implementation directory.
INFO: [Common 17-83] Releasing license: Implementation
22 Infos, 22 Warnings, 0 Critical Warnings and 0 Errors encountered.
write_bitstream completed successfully
write_bitstream: Time (s): cpu = 00:00:13 ; elapsed = 00:00:12 . Memory (MB): peak = 1517.559 ; gain = 460.996
INFO: [Common 17-206] Exiting Vivado at Sun May  8 12:05:43 2022...
